[
  {
    "id": "lvl_019_01",
    "region": "region_019_moon_carnival",
    "index": 1,
    "seed": 267535,
    "class": "simple",
    "difficulty": 0.05,
    "goal": {
      "type": "reachFloor",
      "value": 60
    },
    "stars": [
      {
        "type": "clear"
      },
      {
        "type": "coins",
        "value": 25
      },
      {
        "type": "noRevive"
      }
    ],
    "rewards": {
      "coinPayout": 60,
      "replayCoinPercent": 40,
      "gems": {
        "chance": 0.03,
        "min": 1,
        "max": 1
      }
    }
  },
  {
    "id": "lvl_019_02",
    "region": "region_019_moon_carnival",
    "index": 2,
    "seed": 372264,
    "class": "simple",
    "difficulty": 0.1,
    "goal": {
      "type": "reachFloor",
      "value": 90
    },
    "stars": [
      {
        "type": "clear"
      },
      {
        "type": "coins",
        "value": 30
      },
      {
        "type": "noRevive"
      }
    ],
    "rewards": {
      "coinPayout": 65,
      "replayCoinPercent": 40,
      "gems": {
        "chance": 0.03,
        "min": 1,
        "max": 1
      }
    }
  },
  {
    "id": "lvl_019_03",
    "region": "region_019_moon_carnival",
    "index": 3,
    "seed": 476993,
    "class": "simple",
    "difficulty": 0.15,
    "goal": {
      "type": "reachFloor",
      "value": 120
    },
    "stars": [
      {
        "type": "clear"
      },
      {
        "type": "coins",
        "value": 35
      },
      {
        "type": "noRevive"
      }
    ],
    "rewards": {
      "coinPayout": 75,
      "replayCoinPercent": 40,
      "gems": {
        "chance": 0.03,
        "min": 1,
        "max": 1
      }
    }
  },
  {
    "id": "lvl_019_04",
    "region": "region_019_moon_carnival",
    "index": 4,
    "seed": 581722,
    "class": "simple",
    "difficulty": 0.22,
    "goal": {
      "type": "reachFloor",
      "value": 100
    },
    "stars": [
      {
        "type": "clear"
      },
      {
        "type": "coins",
        "value": 40
      },
      {
        "type": "noRevive"
      }
    ],
    "rewards": {
      "coinPayout": 80,
      "replayCoinPercent": 40,
      "gems": {
        "chance": 0.03,
        "min": 1,
        "max": 1
      }
    }
  },
  {
    "id": "lvl_019_05",
    "region": "region_019_moon_carnival",
    "index": 5,
    "seed": 686451,
    "class": "complex",
    "difficulty": 0.4,
    "goal": {
      "type": "comboChain",
      "value": 3,
      "count": 2
    },
    "stars": [
      {
        "type": "clear"
      },
      {
        "type": "coins",
        "value": 45
      },
      {
        "type": "noRevive"
      }
    ],
    "rewards": {
      "coinPayout": 300,
      "replayCoinPercent": 40,
      "gems": {
        "chance": 0.25,
        "min": 1,
        "max": 3
      }
    },
    "overrides": {
      "fixedChunks": [
        "chunk_complex_a"
      ]
    }
  },
  {
    "id": "lvl_019_06",
    "region": "region_019_moon_carnival",
    "index": 6,
    "seed": 791180,
    "class": "medium",
    "difficulty": 0.35,
    "goal": {
      "type": "reachFloor",
      "value": 160
    },
    "stars": [
      {
        "type": "clear"
      },
      {
        "type": "coins",
        "value": 50
      },
      {
        "type": "noRevive"
      }
    ],
    "rewards": {
      "coinPayout": 90,
      "replayCoinPercent": 40,
      "gems": {
        "chance": 0.03,
        "min": 1,
        "max": 1
      }
    }
  },
  {
    "id": "lvl_019_07",
    "region": "region_019_moon_carnival",
    "index": 7,
    "seed": 895909,
    "class": "medium",
    "difficulty": 0.42,
    "goal": {
      "type": "noWallBounce",
      "value": 120
    },
    "stars": [
      {
        "type": "clear"
      },
      {
        "type": "coins",
        "value": 55
      },
      {
        "type": "noRevive"
      }
    ],
    "rewards": {
      "coinPayout": 95,
      "replayCoinPercent": 40,
      "gems": {
        "chance": 0.03,
        "min": 1,
        "max": 1
      }
    }
  },
  {
    "id": "lvl_019_08",
    "region": "region_019_moon_carnival",
    "index": 8,
    "seed": 1000638,
    "class": "medium",
    "difficulty": 0.5,
    "goal": {
      "type": "findHiddenGem"
    },
    "stars": [
      {
        "type": "clear"
      },
      {
        "type": "coins",
        "value": 60
      },
      {
        "type": "noRevive"
      }
    ],
    "rewards": {
      "coinPayout": 105,
      "replayCoinPercent": 40,
      "gems": {
        "chance": 0.03,
        "min": 1,
        "max": 1
      }
    }
  },
  {
    "id": "lvl_019_09",
    "region": "region_019_moon_carnival",
    "index": 9,
    "seed": 1105367,
    "class": "medium",
    "difficulty": 0.58,
    "goal": {
      "type": "reachFloor",
      "value": 180
    },
    "stars": [
      {
        "type": "clear"
      },
      {
        "type": "coins",
        "value": 65
      },
      {
        "type": "noRevive"
      }
    ],
    "rewards": {
      "coinPayout": 110,
      "replayCoinPercent": 40,
      "gems": {
        "chance": 0.03,
        "min": 1,
        "max": 1
      }
    }
  },
  {
    "id": "lvl_019_10",
    "region": "region_019_moon_carnival",
    "index": 10,
    "seed": 1210096,
    "class": "complex",
    "difficulty": 0.7,
    "goal": {
      "type": "surviveWave"
    },
    "stars": [
      {
        "type": "clear"
      },
      {
        "type": "coins",
        "value": 70
      },
      {
        "type": "noRevive"
      }
    ],
    "rewards": {
      "coinPayout": 300,
      "replayCoinPercent": 40,
      "gems": {
        "chance": 0.25,
        "min": 1,
        "max": 3,
        "firstClearGuaranteed": 1
      }
    },
    "overrides": {
      "fixedChunks": [
        "chunk_complex_a"
      ]
    }
  },
  {
    "id": "lvl_019_11",
    "region": "region_019_moon_carnival",
    "index": 11,
    "seed": 1314825,
    "class": "hard",
    "difficulty": 0.62,
    "goal": {
      "type": "comboChain",
      "value": 6,
      "count": 1
    },
    "stars": [
      {
        "type": "clear"
      },
      {
        "type": "coins",
        "value": 75
      },
      {
        "type": "noRevive"
      }
    ],
    "rewards": {
      "coinPayout": 120,
      "replayCoinPercent": 40,
      "gems": {
        "chance": 0.03,
        "min": 1,
        "max": 1
      }
    }
  },
  {
    "id": "lvl_019_12",
    "region": "region_019_moon_carnival",
    "index": 12,
    "seed": 1419554,
    "class": "hard",
    "difficulty": 0.7,
    "goal": {
      "type": "reachFloor",
      "value": 200
    },
    "stars": [
      {
        "type": "clear"
      },
      {
        "type": "coins",
        "value": 80
      },
      {
        "type": "noRevive"
      }
    ],
    "rewards": {
      "coinPayout": 125,
      "replayCoinPercent": 40,
      "gems": {
        "chance": 0.03,
        "min": 1,
        "max": 1
      }
    }
  },
  {
    "id": "lvl_019_13",
    "region": "region_019_moon_carnival",
    "index": 13,
    "seed": 1524283,
    "class": "hard",
    "difficulty": 0.78,
    "goal": {
      "type": "reachFloor",
      "value": 220
    },
    "stars": [
      {
        "type": "clear"
      },
      {
        "type": "coins",
        "value": 85
      },
      {
        "type": "noRevive"
      }
    ],
    "rewards": {
      "coinPayout": 135,
      "replayCoinPercent": 40,
      "gems": {
        "chance": 0.03,
        "min": 1,
        "max": 1
      }
    }
  },
  {
    "id": "lvl_019_14",
    "region": "region_019_moon_carnival",
    "index": 14,
    "seed": 1629012,
    "class": "hard",
    "difficulty": 0.86,
    "goal": {
      "type": "reachFloor",
      "value": 240
    },
    "stars": [
      {
        "type": "clear"
      },
      {
        "type": "coins",
        "value": 90
      },
      {
        "type": "noRevive"
      }
    ],
    "rewards": {
      "coinPayout": 140,
      "replayCoinPercent": 40,
      "gems": {
        "chance": 0.03,
        "min": 1,
        "max": 1
      }
    }
  },
  {
    "id": "lvl_019_15",
    "region": "region_019_moon_carnival",
    "index": 15,
    "seed": 1733741,
    "class": "highly_complex",
    "difficulty": 1.0,
    "goal": {
      "type": "bossChase",
      "value": 250
    },
    "stars": [
      {
        "type": "clear"
      },
      {
        "type": "coins",
        "value": 95
      },
      {
        "type": "noRevive"
      }
    ],
    "rewards": {
      "coinPayout": 900,
      "replayCoinPercent": 40,
      "gems": {
        "chance": 1.0,
        "min": 5,
        "max": 5,
        "firstClearGuaranteed": 5,
        "starBonusMax": 5,
        "replayChance": 0.5,
        "replayAmount": 2
      }
    },
    "overrides": {
      "fixedChunks": [
        "chunk_gauntlet_a"
      ],
      "ramp": true
    }
  }
]
